{
  "$schema": "https://json-schema.org/draft/2020-12/schema",
  "$id": "https://threats.opena2a.org/schema/threat-matrix-v1.2.schema.json",
  "title": "AI Agent Threat Matrix 1.2",
  "description": "Shape of matrix.json. Technique ids are T-NNNN, or T-NNNN.NNN for a sub-technique; sub-techniques sit flat in techniques[] and carry parentId. The nine technique fields required by 1.1 are unchanged and still required. Every field added in 1.2 is optional. Added after the 1.2 release and required: wildPrevalence and wildSampleCount on every technique, and the top-level wildPrevalenceSource that says where and when they were read. Changed after the 1.2 release, while no technique carried a data source: an entry of the top-level dataSources registry requires readBy, and the items of a technique's dataSources are objects that name the source and the check, signature or sensor field that uses it, where they were bare ids. scripts/validate_matrix.py checks this schema with an in-repo subset checker and then the cross-field rules the schema cannot express (see the x-semantic notes).",
  "type": "object",
  "required": ["version", "name", "created", "updated", "stixNamespace", "tactics", "techniques", "attackClasses", "attackPaths", "dataSources", "wildPrevalenceSource"],
  "additionalProperties": false,
  "properties": {
    "version": { "const": "1.2" },
    "name": { "type": "string" },
    "created": { "$ref": "#/$defs/date" },
    "updated": { "$ref": "#/$defs/date" },
    "stixNamespace": {
      "description": "UUID namespace for the deterministic STIX 2.1 ids in stix/agent-threat-matrix-bundle.json (uuid5 over this namespace and a canonical object name). Pinned: changing it changes every STIX id ever published.",
      "const": "d43c7092-69ad-4822-b2cb-a48e459c4580"
    },
    "tactics": { "type": "array", "items": { "$ref": "#/$defs/tactic" } },
    "techniques": { "type": "array", "items": { "$ref": "#/$defs/technique" } },
    "attackClasses": { "type": "array", "items": { "$ref": "#/$defs/attackClass" } },
    "attackPaths": { "type": "array", "items": { "$ref": "#/$defs/attackPath" } },
    "dataSources": {
      "description": "The data source vocabulary: telemetry a defender can collect, where each entry cites the file and line of a tool or sensor that reads it. A technique cites entries in its dataSources array. May be empty.",
      "type": "array",
      "items": { "$ref": "#/$defs/dataSource" }
    },
    "wildPrevalenceSource": { "$ref": "#/$defs/wildPrevalenceSource" }
  },
  "$defs": {
    "date": { "type": "string", "pattern": "^[0-9]{4}-[0-9]{2}-[0-9]{2}$" },
    "techniqueId": { "type": "string", "pattern": "^T-[0-9]{4}(\\.[0-9]{3})?$" },
    "parentTechniqueId": { "type": "string", "pattern": "^T-[0-9]{4}$" },
    "tacticId": { "type": "string", "pattern": "^[a-z][a-z0-9-]*$" },
    "attackClassId": { "type": "string", "pattern": "^[A-Z][A-Z0-9]*(-[A-Z0-9]+)*$" },
    "semver": { "type": "string", "pattern": "^(0|[1-9][0-9]*)\\.(0|[1-9][0-9]*)\\.(0|[1-9][0-9]*)$" },
    "mappingRelationship": {
      "description": "SKOS mapping relation between the matrix technique and the external technique.",
      "enum": ["exactMatch", "closeMatch", "broadMatch", "narrowMatch", "relatedMatch"]
    },
    "tactic": {
      "type": "object",
      "required": ["id", "name", "order", "description"],
      "additionalProperties": false,
      "properties": {
        "id": { "$ref": "#/$defs/tacticId" },
        "name": { "type": "string" },
        "order": { "type": "integer" },
        "description": { "type": "string" }
      }
    },
    "technique": {
      "type": "object",
      "required": ["id", "name", "tactic", "description", "evidenceTier", "attackClass", "hmaChecks", "dvaaValidation", "oasbControls", "wildPrevalence", "wildSampleCount"],
      "additionalProperties": false,
      "properties": {
        "id": { "$ref": "#/$defs/techniqueId" },
        "name": { "type": "string" },
        "tactic": {
          "$ref": "#/$defs/tacticId",
          "x-semantic": "must be the id of an entry in tactics[]"
        },
        "description": { "type": "string" },
        "evidenceTier": { "enum": ["observed", "validated", "adapted"] },
        "attackClass": {
          "$ref": "#/$defs/attackClassId",
          "x-semantic": "must be the id of an entry in attackClasses[]"
        },
        "hmaChecks": { "type": "array", "items": { "type": "string" } },
        "dvaaValidation": {
          "type": ["string", "null"],
          "description": "Null when the technique carries no lab scenario.",
          "x-semantic": "must be null when evidenceTier is adapted"
        },
        "oasbControls": { "type": "array", "items": { "type": "string", "pattern": "^[0-9]+\\.[0-9]+$" } },
        "wildPrevalence": {
          "description": "The wildPrevalence the registry endpoint in wildPrevalenceSource served for this technique on the read date, and 0 where it served none. The registry computes it from its honeypot telemetry as callbacks per page visit in the technique's category: callbacks divided by page visits, as a percentage rounded to two decimals and capped at 100, and 0 where the category has no page visits. The callbacks are the canary fires in the technique's category and the payload callbacks of the payloads mapped to the technique. It measures engagement with a honeypot, not a production attack rate. Written by scripts/sync_wild_prevalence.py, not by hand. Read it with wildSampleCount and the read date. It does not set or change evidenceTier.",
          "type": "number",
          "minimum": 0,
          "maximum": 100
        },
        "wildSampleCount": {
          "description": "The wildSampleCount the same endpoint served with wildPrevalence, and 0 where it served none: the callbacks plus the page visits behind that wildPrevalence, a whole number. 0 means the technique has no wild samples behind it.",
          "type": "integer",
          "minimum": 0,
          "x-semantic": "must be above 0 wherever wildPrevalence is above 0"
        },
        "parentId": {
          "$ref": "#/$defs/parentTechniqueId",
          "x-semantic": "required if and only if id is dotted; must be the id of a technique in techniques[] and equal the part of id before the dot"
        },
        "attackMapping": { "type": "array", "items": { "$ref": "#/$defs/attackMappingEntry" } },
        "atlasMapping": { "type": "array", "items": { "$ref": "#/$defs/atlasMappingEntry" } },
        "dataSources": {
          "description": "The data sources a defender collects to see this technique, each with the check, signature or sensor field that uses it for this technique. Absent or empty means unmapped.",
          "type": "array",
          "items": { "$ref": "#/$defs/dataSourceMapping" },
          "x-semantic": "every source must be the id of an entry in the top-level dataSources[] registry, and every tool must be a tool that entry's readBy cites"
        },
        "evidence": {
          "type": "array",
          "items": { "$ref": "#/$defs/evidenceEntry" },
          "x-semantic": "every entry must resolve to a source scripts/validate_matrix.py reads, and no entry may repeat another's type, reference and date: a honeypot-telemetry entry resolves when its reference is the wildPrevalenceSource url, its date is the wildPrevalenceSource read date and the technique's wildSampleCount is above 0; a lab-reproduction entry resolves when its reference is the permalink of a page that evidence-sources.json pins, <repository>/blob/<commit>/<path>, its date is the page's committed date and the page names the technique's id with the technique's name as the label, or when its reference is the permalink of a challenge, <repository>/blob/<commit>/<path>#L<line>, or of a scenario page that evidence-sources.json pins for a dvaaValidation, its date is the committed date of that file and a value of the technique's dvaaValidation is the challenge's id or the scenario's name; no other reference resolves"
        },
        "status": {
          "description": "Absent means active.",
          "enum": ["draft", "active", "deprecated"]
        },
        "replacedBy": {
          "$ref": "#/$defs/techniqueId",
          "x-semantic": "required if and only if status is deprecated; must be the id of a technique in techniques[]"
        },
        "version": {
          "description": "Semantic version of this technique entry. Absent means 1.0.0.",
          "$ref": "#/$defs/semver"
        }
      }
    },
    "attackMappingEntry": {
      "type": "object",
      "required": ["id", "relationship"],
      "additionalProperties": false,
      "properties": {
        "id": { "type": "string", "pattern": "^T[0-9]{4}(\\.[0-9]{3})?$", "description": "MITRE ATT&CK technique or sub-technique id" },
        "relationship": { "$ref": "#/$defs/mappingRelationship" },
        "note": { "type": "string" }
      }
    },
    "atlasMappingEntry": {
      "type": "object",
      "required": ["id", "relationship"],
      "additionalProperties": false,
      "properties": {
        "id": { "type": "string", "pattern": "^AML\\.T[0-9]{4}(\\.[0-9]{3})?$", "description": "MITRE ATLAS technique or sub-technique id" },
        "relationship": { "$ref": "#/$defs/mappingRelationship" },
        "note": { "type": "string" }
      }
    },
    "evidenceEntry": {
      "type": "object",
      "required": ["type", "reference", "date"],
      "additionalProperties": false,
      "properties": {
        "type": {
          "description": "Kind of publicly resolvable source the reference points at.",
          "enum": ["observation", "lab-reproduction", "publication", "advisory", "honeypot-telemetry"]
        },
        "reference": { "type": "string" },
        "date": { "$ref": "#/$defs/date" },
        "note": { "type": "string" }
      }
    },
    "wildPrevalenceSource": {
      "description": "Where and when the wildPrevalence and wildSampleCount of every technique were read. scripts/sync_wild_prevalence.py writes it with them.",
      "type": "object",
      "required": ["url", "read"],
      "additionalProperties": false,
      "properties": {
        "url": { "type": "string", "pattern": "^https://", "description": "The registry endpoint the values were read from." },
        "read": { "$ref": "#/$defs/date", "description": "The date the endpoint was read." }
      }
    },
    "dataSource": {
      "type": "object",
      "required": ["id", "name", "description", "readBy"],
      "additionalProperties": false,
      "properties": {
        "id": { "type": "string", "pattern": "^[a-z][a-z0-9-]*$" },
        "name": { "type": "string" },
        "description": { "type": "string" },
        "readBy": {
          "description": "The tools or sensors that read this data, each cited at the file and line that reads it. A source with no reader is not admitted.",
          "type": "array",
          "minItems": 1,
          "items": { "$ref": "#/$defs/sourceReader" }
        }
      }
    },
    "sourceReader": {
      "description": "One tool or sensor that reads a data source, cited at a file and line of its repository at a pinned commit.",
      "type": "object",
      "required": ["tool", "repository", "commit", "path", "line"],
      "additionalProperties": false,
      "properties": {
        "tool": { "type": "string", "pattern": "^[a-z][a-z0-9-]*$", "description": "The tool or sensor, named as a technique's dataSources mapping names it." },
        "repository": { "type": "string", "pattern": "^[A-Za-z0-9][A-Za-z0-9-]*/[A-Za-z0-9._-]+$", "description": "GitHub owner/name of the repository that holds the reading code." },
        "commit": { "type": "string", "pattern": "^[0-9a-f]{40}$", "description": "The 40-hex sha of the commit at which path and line were read." },
        "path": { "type": "string", "pattern": "^[^/\\s][^\\s]*$", "description": "Path of the reading file, relative to the repository root." },
        "line": { "type": "integer", "minimum": 1, "description": "Line of path, at commit, where the data is read." }
      }
    },
    "dataSourceMapping": {
      "description": "One data source a technique is seen in, and the check, signature or sensor field that uses it for this technique.",
      "type": "object",
      "required": ["source", "tool", "kind", "ref"],
      "additionalProperties": false,
      "properties": {
        "source": { "type": "string", "pattern": "^[a-z][a-z0-9-]*$", "description": "Id of an entry in the top-level dataSources[] registry." },
        "tool": { "type": "string", "pattern": "^[a-z][a-z0-9-]*$", "description": "The tool or sensor whose check, signature or sensor field this is; one that the source's readBy cites." },
        "kind": { "enum": ["check", "signature", "sensorField"] },
        "ref": { "type": "string", "pattern": "^\\S(.*\\S)?$", "description": "The check id, signature id or sensor field name, as the tool writes it." }
      }
    },
    "attackClass": {
      "type": "object",
      "required": ["id", "name", "description", "techniques", "hmaChecks", "category"],
      "additionalProperties": false,
      "properties": {
        "id": { "$ref": "#/$defs/attackClassId" },
        "name": { "type": "string" },
        "description": { "type": "string" },
        "techniques": { "type": "array", "items": { "$ref": "#/$defs/techniqueId" } },
        "hmaChecks": { "type": "array", "items": { "type": "string" } },
        "category": { "type": "string" }
      }
    },
    "attackPath": {
      "type": "object",
      "required": ["id", "name", "description", "techniques"],
      "additionalProperties": false,
      "properties": {
        "id": { "type": "string" },
        "name": { "type": "string" },
        "description": { "type": "string" },
        "techniques": { "type": "array", "items": { "$ref": "#/$defs/techniqueId" } }
      }
    }
  }
}
