{
  "version": "1.2",
  "name": "AI Agent Threat Matrix",
  "created": "2026-03-24",
  "updated": "2026-10-19",
  "stixNamespace": "d43c7092-69ad-4822-b2cb-a48e459c4580",
  "tactics": [
    {
      "id": "reconnaissance",
      "name": "Reconnaissance",
      "order": 1,
      "description": "Map the target agent's attack surface, capabilities, and behavioral boundaries"
    },
    {
      "id": "initial-access",
      "name": "Initial Access",
      "order": 2,
      "description": "Gain control over agent behavior through prompt manipulation or input exploitation"
    },
    {
      "id": "credential-harvest",
      "name": "Credential Harvest",
      "order": 3,
      "description": "Extract API keys, tokens, and credentials from agent context and connected services"
    },
    {
      "id": "privilege-escalation",
      "name": "Privilege Escalation",
      "order": 4,
      "description": "Escalate capabilities beyond declared scope or bypass authorization"
    },
    {
      "id": "lateral-movement",
      "name": "Lateral Movement",
      "order": 5,
      "description": "Pivot from compromised agent to connected services or other agents"
    },
    {
      "id": "persistence",
      "name": "Persistence",
      "order": 6,
      "description": "Establish persistent access surviving restarts and session changes"
    },
    {
      "id": "collection",
      "name": "Collection",
      "order": 7,
      "description": "Gather and stage data from databases, file systems, and APIs"
    },
    {
      "id": "exfiltration",
      "name": "Exfiltration",
      "order": 8,
      "description": "Transfer collected data out of target environment"
    },
    {
      "id": "impact",
      "name": "Impact",
      "order": 9,
      "description": "Modify data, deploy malicious code, or disrupt services"
    }
  ],
  "techniques": [
    {
      "id": "T-1001",
      "name": "Endpoint Enumeration",
      "tactic": "reconnaissance",
      "description": "Discover exposed API endpoints, health checks, and information disclosure routes on target agents",
      "evidenceTier": "observed",
      "attackClass": "RETROACTIVE-PRIV",
      "hmaChecks": [
        "WEBEXPOSE-001",
        "WEBEXPOSE-002",
        "MCP-011"
      ],
      "dvaaValidation": "All agents expose /health and /info",
      "oasbControls": [
        "1.1",
        "1.2",
        "1.3",
        "1.4",
        "10.5"
      ],
      "wildPrevalence": 0,
      "wildSampleCount": 0
    },
    {
      "id": "T-1002",
      "name": "Tool Discovery",
      "tactic": "reconnaissance",
      "description": "Enumerate available tools and their schemas via MCP tools/list or equivalent discovery endpoints",
      "evidenceTier": "validated",
      "attackClass": "MCP-EXPLOIT",
      "hmaChecks": [
        "MCP-011"
      ],
      "dvaaValidation": "ToolBot tools/list",
      "oasbControls": [
        "10.5"
      ],
      "wildPrevalence": 100,
      "wildSampleCount": 2566
    },
    {
      "id": "T-1003",
      "name": "System Prompt Extraction",
      "tactic": "reconnaissance",
      "description": "Extract the agent's system prompt to understand its instructions, constraints, and behavioral boundaries",
      "evidenceTier": "validated",
      "attackClass": "SOUL-INJECT",
      "hmaChecks": [
        "WEBEXPOSE-001"
      ],
      "dvaaValidation": "L1-01",
      "oasbControls": [
        "1.1",
        "1.2",
        "1.3",
        "1.4"
      ],
      "wildPrevalence": 100,
      "wildSampleCount": 11308
    },
    {
      "id": "T-1004",
      "name": "Security Level Probing",
      "tactic": "reconnaissance",
      "description": "Probe the agent to determine its security posture, guardrails, and content filtering strength",
      "evidenceTier": "validated",
      "attackClass": "RETROACTIVE-PRIV",
      "hmaChecks": [
        "WEBEXPOSE-001"
      ],
      "dvaaValidation": "Probing agents",
      "oasbControls": [
        "1.1",
        "1.2",
        "1.3",
        "1.4"
      ],
      "wildPrevalence": 0,
      "wildSampleCount": 0
    },
    {
      "id": "T-1005",
      "name": "Capability Mapping",
      "tactic": "reconnaissance",
      "description": "Map the full set of agent capabilities including tools, permissions, and connected services",
      "evidenceTier": "validated",
      "attackClass": "MCP-EXPLOIT",
      "hmaChecks": [
        "MCP-011",
        "MCP-001"
      ],
      "dvaaValidation": "ToolBot tool catalog",
      "oasbControls": [
        "10.5"
      ],
      "wildPrevalence": 0,
      "wildSampleCount": 0
    },
    {
      "id": "T-1006",
      "name": "Agent Card Discovery",
      "tactic": "reconnaissance",
      "description": "Discover A2A agent cards to map agent identities, capabilities, and trust relationships",
      "evidenceTier": "observed",
      "attackClass": "A2A-EXPOSE",
      "hmaChecks": [
        "A2A-001",
        "A2A-002"
      ],
      "dvaaValidation": "Orchestrator /a2a/agent-card",
      "oasbControls": [
        "7.1",
        "7.2",
        "7.3",
        "7.4"
      ],
      "wildPrevalence": 0,
      "wildSampleCount": 0
    },
    {
      "id": "T-1007",
      "name": "Context Window Probing",
      "tactic": "reconnaissance",
      "description": "Probe the agent's context window size and saturation level to prepare overflow attacks",
      "evidenceTier": "validated",
      "attackClass": "RETROACTIVE-PRIV",
      "hmaChecks": [
        "WEBEXPOSE-001"
      ],
      "dvaaValidation": "LongwindBot context overflow",
      "oasbControls": [
        "10.5"
      ],
      "wildPrevalence": 0,
      "wildSampleCount": 0
    },
    {
      "id": "T-2001",
      "name": "Direct Prompt Injection",
      "tactic": "initial-access",
      "description": "Inject malicious instructions directly into agent input to override system prompt behavior",
      "evidenceTier": "observed",
      "attackClass": "SOUL-INJECT",
      "hmaChecks": [
        "PROMPT-001",
        "PROMPT-002",
        "PROMPT-003",
        "PROMPT-004"
      ],
      "dvaaValidation": "L1-03",
      "oasbControls": [
        "3.1",
        "3.2",
        "3.3",
        "3.4",
        "3.5"
      ],
      "wildPrevalence": 98.44,
      "wildSampleCount": 7610
    },
    {
      "id": "T-2002",
      "name": "Indirect Prompt Injection",
      "tactic": "initial-access",
      "description": "Embed malicious instructions in external data sources consumed by the agent via RAG or tool responses",
      "evidenceTier": "observed",
      "attackClass": "RAG-POISON",
      "hmaChecks": [
        "PROMPT-001",
        "RAG-001",
        "RAG-002",
        "RAG-003",
        "RAG-004"
      ],
      "dvaaValidation": "RAGBot",
      "oasbControls": [
        "3.1",
        "3.2",
        "3.3",
        "3.4",
        "3.5"
      ],
      "wildPrevalence": 97.97,
      "wildSampleCount": 7592
    },
    {
      "id": "T-2003",
      "name": "Role-Play Jailbreak",
      "tactic": "initial-access",
      "description": "Use role-play or persona-switching techniques to bypass agent safety instructions",
      "evidenceTier": "observed",
      "attackClass": "SOUL-INJECT",
      "hmaChecks": [
        "PROMPT-001"
      ],
      "dvaaValidation": "L2-01",
      "oasbControls": [
        "3.1",
        "3.2",
        "3.3",
        "3.4",
        "3.5"
      ],
      "wildPrevalence": 100,
      "wildSampleCount": 3507
    },
    {
      "id": "T-2004",
      "name": "Context Window Exploitation",
      "tactic": "initial-access",
      "description": "Overflow or saturate the context window to displace safety instructions with attacker-controlled content",
      "evidenceTier": "validated",
      "attackClass": "SOUL-DRIFT",
      "hmaChecks": [
        "PROMPT-001",
        "PROMPT-002"
      ],
      "dvaaValidation": "L2-06",
      "oasbControls": [
        "3.1",
        "3.2",
        "3.3",
        "3.4",
        "3.5"
      ],
      "wildPrevalence": 100,
      "wildSampleCount": 2886
    },
    {
      "id": "T-2005",
      "name": "Tool Description Injection",
      "tactic": "initial-access",
      "description": "Embed malicious instructions in tool or skill descriptions that execute when the agent processes them",
      "evidenceTier": "validated",
      "attackClass": "SKILL-FRONTMATTER",
      "hmaChecks": [
        "SKILL-001",
        "SKILL-004",
        "SKILL-005"
      ],
      "dvaaValidation": "PluginBot",
      "oasbControls": [
        "3.1",
        "3.2",
        "3.3",
        "3.4",
        "3.5"
      ],
      "wildPrevalence": 100,
      "wildSampleCount": 2566
    },
    {
      "id": "T-2006",
      "name": "Unicode/Encoding Bypass",
      "tactic": "initial-access",
      "description": "Use Unicode homoglyphs, invisible characters, or encoding tricks to bypass input filters and inject instructions",
      "evidenceTier": "observed",
      "attackClass": "UNICODE-STEGO",
      "hmaChecks": [
        "UNICODE-STEGO-001",
        "UNICODE-STEGO-002",
        "UNICODE-STEGO-003",
        "UNICODE-STEGO-004",
        "UNICODE-STEGO-005"
      ],
      "dvaaValidation": "token-smuggling-unicode",
      "oasbControls": [
        "3.1",
        "3.2",
        "3.3",
        "3.4",
        "3.5"
      ],
      "wildPrevalence": 100,
      "wildSampleCount": 11099
    },
    {
      "id": "T-2007",
      "name": "Multi-Turn Manipulation",
      "tactic": "initial-access",
      "description": "Gradually shift agent behavior over multiple conversation turns to bypass single-turn detection",
      "evidenceTier": "validated",
      "attackClass": "SOUL-INJECT",
      "hmaChecks": [
        "PROMPT-001"
      ],
      "dvaaValidation": "multi-turn challenges",
      "oasbControls": [
        "3.1",
        "3.2",
        "3.3",
        "3.4",
        "3.5"
      ],
      "wildPrevalence": 100,
      "wildSampleCount": 5763
    },
    {
      "id": "T-2008",
      "name": "System Prompt Boundary Bypass",